4.9639196,25382144,Determination Issued - Certification,True,True,H-300-25308-368881,,,Stable Attendant,Asistente de establo,"Crops/Commodities: 
horses - stable work. 
Safe handling concerns require that, to be qualified for this position, workers must have no less than three months of prior verifiable experience as stable assistant in a standardbred horse breeding operation. Employer will hire any worker with the requisite experience who demonstrates he/she can safely and competently perform the job of handling brood mares, stallions and young horses. Persons seeking employment should be available for the entire period requested by employer. Applicant must be capable of safely handling breeding stallions especially subject to international quarantine restrictions. The employer is a large standardbred (harness) horse breeding/sales farm where employment is dependent on the annual breeding through yearling sales seasons. January through July, workers will be responsible for feeding and monitoring broodmares for impending foaling, assist with foal delivery and aftercare, and routine animal husbandry practices. From July through October, workers will handle, train and groom young horses in preparation for annual sales, move horses between fields for weaning, and assist in routine healthcare management. At the conclusion of this period, workers will perform general farm maintenance as needed in preparation for the next season.

Workers perform a variety of tasks associated with the breeding, handling and preparation for sale of standardbred equine stock. These include the following: identify and catch horses in fields, affix halters and lead ropes, lead into barn and tie securely. Competence in basic grooming practices including bathing, brushing, hoof care, clipping. Clean stalls by removing soiled bedding and manure, replace with fresh bedding. Strip stalls and disinfect floors, walls and surrounding areas for broodmares. Sweep barn aisles, stall areas, ceilings to remove dirt, hay, cobwebs and other detritus. Maintain/clean and fill water troughs and buckets.  Handle basic feeding activities including apportioning grain, hay and feed supplements according to instruction. Hold horses for farriers and vets and administer routine intra-muscular injections. Assist in handling young horses in preparation for sales.  

Help maintain equipment, assist with mowing and weeding, cutting and baling hay, work in fields, clean around barns. Workers will load trucks with bales of hay and sacks of grain and feed weighing up to and including 60 pounds and lifting to a height of 5 feet. Workers must demonstrate commonsense and awareness of safe equine handling procedures, i.e., no running in barns, shouting, abusing horses, leaving gates/stall doors/feed rooms open or smoking in and around barns, sheds and hay storage.

In addition to the work outlined above, workers may be required to perform variable tasks such as the following: operation of tractors, mowers, rakes, and other haying equipment under supervision, painting and repairing farm buildings and similar tasks of a general nature common to a horse breeding operation.

Workers are expected to begin work early in the morning when fields may be wet with dew. Temperatures may range from 10 to 100 F. Work requires repetitive movements and extensive walking. Allergies to ragweed, goldenrod, animal dandruff, insect spray, related chemicals, etc. may affect workers' ability to perform the job. Workers should be physically able to do the work required with or without reasonable accommodations. Must be on call for up to 24 hours a day, 6 days a week. Saturday work required. Must be able to lift/carry 60 lbs.

Instructions and general supervision will be provided by a designated lead worker or company supervisor. Exceptionally complex or non-routine activities will be closely supervised. Workers will be expected to perform basic horse management and handling duties in a timely and proficient manner without close supervision.","Cultivos/Materias primas: 
caballos - trabajo de establo. 
Las preocupaciones de manejo seguro requieren que, para estar calificados para este puesto, los trabajadores deben tener no menos de tres meses de experiencia previa verificable como asistente de establo en una operación de cría de caballos de raza estándar. El empleador contratará a cualquier trabajador con la experiencia requerida que demuestre que puede realizar de manera segura y competente el trabajo de manejo de yeguas de cría, sementales y caballos jóvenes. Las personas que buscan empleo deben estar disponibles durante todo el período solicitado por el empleador. El solicitante debe ser capaz de manejar de manera segura sementales reproductores, especialmente sujetos a restricciones de cuarentena internacional. El empleador es una gran granja de cría/venta de caballos de raza estándar (arnés) donde el empleo depende de la cría anual durante las temporadas de venta de potros de un año. De enero a julio, los trabajadores serán responsables de alimentar y monitorear a las yeguas de cría para detectar partos inminentes, ayudar con el parto y el cuidado posterior, y las prácticas rutinarias de cría de animales. De julio a octubre, los trabajadores manejarán, entrenarán y preparador de caballos jóvenes en preparación para las ventas anuales, moverán caballos entre campos para el destete y ayudarán en la gestión de atención médica de rutina. Al final de este período, los trabajadores realizarán el mantenimiento general de la granja según sea necesario en preparación para la próxima temporada.

Los trabajadores realizan una variedad de tareas asociadas con la cría, el manejo y la preparación para la venta de equinos de raza estándar. Estos incluyen los siguientes: identificar y atrapar caballos en los campos, colocar cabestros y cuerdas de plomo, llevar al establo y atar de forma segura. Competencia en prácticas básicas de aseo que incluyen baño, cepillado, cuidado de pezuñas, corte. Limpie los establos quitando la ropa de cama sucia y el estiércol, reemplácelos con ropa de cama fresca. Retire los establos y desinfecte los pisos, las paredes y las áreas circundantes para las yeguas de cría. Barre los pasillos del establo, las áreas de establos y los techos para eliminar la suciedad, el heno, las telarañas y otros detritus. Mantener/limpiar y llenar los bebederos y cubos de agua.  Manejar las actividades básicas de alimentación, incluida la distribución de granos, heno y suplementos alimenticios, de acuerdo con las instrucciones. Sujete caballos para herradores y veterinarios y administre inyecciones intramusculares de rutina. Ayudar en el manejo de caballos jóvenes en preparación para las ventas.  

Ayudar a mantener el equipo, ayudar con el corte y el deshierbe, cortar y empacar heno, trabajar en los campos, limpiar alrededor de los graneros. Los trabajadores cargarán camiones con fardos de heno y sacos de grano y alimento que pesen hasta 60 libras e incluirán y los elevarán a una altura de 5 pies. Los trabajadores deben demostrar sentido común y conciencia de los procedimientos seguros de manejo equino, es decir, no correr en los establos, gritar, maltratar a los caballos, dejar abiertas las puertas/puertas de los establos/salas de alimentación o fumar dentro y alrededor de los establos, cobertizos y almacenamiento de heno.

Además del trabajo descrito anteriormente, es posible que se requiera que los trabajadores realicen tareas variables como las siguientes: operación de tractores, segadoras, rastrillos y otros equipos de heno bajo supervisión, pintura y reparación de edificios agrícolas y tareas similares de naturaleza general comunes a una operación de cría de caballos.

Se espera que los trabajadores comiencen a trabajar temprano en la mañana, cuando los campos pueden estar mojados por el rocío. Las temperaturas pueden oscilar entre 10 y 100 F. El trabajo requiere movimientos repetitivos y caminatas extensas. Las alergias a la ambrosía, la vara de oro, la caspa animal, el repelente de insectos, los productos químicos relacionados, etc. pueden afectar la capacidad de los trabajadores para realizar el trabajo. Los trabajadores deben ser físicamente capaces de realizar el trabajo requerido con o sin adaptaciones razonables. Debe estar de guardia hasta 24 horas al día, 6 días a la semana. Se requiere trabajo los sábados. Debe ser capaz de levantar/transportar 60 libras.

Las instrucciones y la supervisión general serán proporcionadas por un trabajador principal designado o un supervisor de la empresa. Las actividades excepcionalmente complejas o no rutinarias serán supervisadas de cerca. Se espera que los trabajadores realicen tareas básicas de manejo y manejo de caballos de manera oportuna y competente sin una estrecha supervisión.",42.0,1,0.0,15.0,0.0,0.0,True,8:00 A.M.,4:00 P.M.,2026-01-06T00:00:00Z,2026-11-06T00:00:00Z,True,3,This job requires three months of prior verifiable experience as stable assistant in a standardbred horse breeding operation. Applicants must be able to furnish verifiable job reference(s) or comparable third party documentation from recent employer(s) establishing acceptable prior experience. Saturday work required. Must be able to lift/carry 60 lbs.,Este trabajo requiere tres meses de experiencia previa verificable como asistente de establo en una operación de cría de caballos de raza estándar. Los solicitantes deben ser capaces de proporcionar referencias laborales verificables o documentación comparable de terceros de empleadores recientes que demuestren una experiencia previa aceptable. Se requiere trabajo los sábados. Debe ser capaz de levantar/transportar 60 libras.,False,0,None,,Hour,"Kopec Veterinary Associates, PC.",,Marietta,PENNSYLVANIA,17547,+17173618700,,kvaequine@gmail.com,11292,,H-2A,False,400 Stackstown Road,,,,Marietta,PENNSYLVANIA,17547,2025-11-14T00:00:00Z,1970-01-01T00:00:00Z,45-2093.00,"Farmworkers, Farm, Ranch, and Aquacultural Animals",,"{'type': 'Point', 'coordinates': [-76.56765, 40.070995], 'crs': {'type': 'name', 'properties': {'name': 'EPSG:4326'}}}",True,kvaequine@gmail.com,+17173618700,N/A,True,1302,True,38779023,2025-12-09T20:14:00.678Z,N/A,2026-06-07T00:00:00Z,2025-11-14T15:03:17Z,0.0,,,False,False,2
4.9639196,25404913,Determination Issued - Certification,True,True,H-300-25310-384547,,Cattle/Calving,Livestock Farmworker,Trabajador de granja ganadera,"Our calving season begins in December and runs through the end of February. During this time, cattle are brought in from pastures and confined for calving, requiring additional care, feeding, and assistance with deliveries. Because pastures are unavailable in winter, cows must be fed daily, and we also focus on repairing fences during this period. From mid-December through the end of February, we need help with calving, feeding cattle, and maintaining fences. In the summer months, cattle graze on pasture, so feeding is not required. Job duties include feeding and watering livestock; monitoring feed and water supplies; mixing feed, additives, and medicines in prescribed portions; and ordering and distributing feed using trucks, tractors, or other equipment. Employees will examine animals to detect illness, injury, disease, or abnormal weight gain, and will segregate, mark, and identify livestock for ownership, grade, or condition using brands, tags, paint, or tattoos. Once the calving season ends, cattle are returned to pasture and require minimal daily care. Employer may provide pay increases for performance, longevity and/or experience at employer’s discretion. Employer may provide performance bonuses at the end of the contract at the employer’s discretion.","Nuestra temporada de parto comienza en diciembre y se extiende hasta finales de febrero. Durante este tiempo, el ganado se trae de los pastizales y se confina para el parto, lo que requiere cuidados, alimentación y asistencia adicionales con las entregas. Debido a que los pastos no están disponibles en invierno, las vacas deben alimentarse diariamente y también nos enfocamos en reparar las cercas durante este período. Desde mediados de diciembre hasta finales de febrero, necesitamos ayuda con el parto, la alimentación del ganado y el mantenimiento de las cercas. En los meses de verano, el ganado pasta en los pastos, por lo que no es necesario alimentarse. Los deberes del trabajo incluyen alimentar y abrevar al ganado; monitoreo de los suministros de alimento y agua; mezclar piensos, aditivos y medicamentos en las porciones prescritas; y el pedido y distribución de alimentos mediante camiones, tractores u otros equipos. Los empleados examinarán a los animales para detectar enfermedades, lesiones, dolencias o aumento de peso anormal, y segregarán, marcarán e identificarán el ganado para determinar su propiedad, grado o condición utilizando marcas, etiquetas, pintura o tatuajes. Una vez que termina la temporada de parto, el ganado se devuelve a pastar y requiere un cuidado diario mínimo. El empleador puede proporcionar aumentos salariales por desempeño, longevidad y/o experiencia a discreción del empleador. El empleador puede proporcionar bonificaciones por desempeño al final del contrato a discreción del empleador.",50.0,1,0.0,16.22,0.0,0.0,True,8:00 A.M.,6:00 P.M.,2026-01-06T00:00:00Z,2026-02-20T00:00:00Z,True,3,"Employer will conduct post-hire drug tests at no cost to the employee to enforce a drug-free workplace policy; failure to pass a drug test will result in termination. Employer will also conduct post-hire criminal background checks at no cost to the employee and will not employ anyone with a felony or theft-related criminal background, in accordance with workplace safety policies and company hiring practices as allowed by law. The job requires exposure to extreme outdoor temperatures, extensive pushing and pulling, repetitive movements, the ability to lift up to 75 lbs, and a valid regular drivers license.  Require 3 months experience.","El empleador realizará pruebas de drogas posteriores a la contratación sin costo para el empleado para hacer cumplir una política de lugar de trabajo libre de drogas; Si no se pasa una prueba de drogas, se dará lugar a la rescisión. El empleador también llevará a cabo verificaciones de antecedentes penales posteriores a la contratación sin costo para el empleado y no empleará a nadie con antecedentes penales relacionados con delitos graves o robos, de acuerdo con las políticas de seguridad en el lugar de trabajo y las prácticas de contratación de la empresa según lo permita la ley. El trabajo requiere exposición a temperaturas exteriores extremas, empujar y tirar mucho, movimientos repetitivos, la capacidad de levantar hasta 75 libras y una licencia de conducir regular válida.  Requiere 3 meses de experiencia.",False,0,None,,Hour,Little Goose Creek Farms LLC,,Jesup,GEORGIA,31545,+19122946459,,n/a,115113,,H-2A,False,636 McClain Rd,14.47/hr (H-2A),14.47/hr (H-2A),,Jesup,GEORGIA,31545,2025-11-20T00:00:00Z,1970-01-01T00:00:00Z,45-2093.00,"Farmworkers, Farm, Ranch, and Aquacultural Animals",,"{'type': 'Point', 'coordinates': [-81.90787, 31.645992], 'crs': {'type': 'name', 'properties': {'name': 'EPSG:4326'}}}",True,jwoliver6476@gmail.com,+19122946459,N/A,True,200,True,38637176,2025-12-02T19:29:07.279Z,N/A,2026-01-28T12:00:00Z,2025-11-20T12:05:05Z,0.0,,,False,False,2
4.9639196,25410849,Determination Issued - Certification,True,True,H-300-25318-410511,,,honeybee farm work,Trabajo en la granja de abejas melíferas,"Commercial beekeeping ; raise queen bees. harvest and extract honey. feed and medicate hives.
Scrape frames. Build paint and repair equipment. 
Job requires minimum of 6 months of agricultural experience working on a honeybee farm handling manual and mechanized tasks with accuracy and efficiency. 
Applicants must be able to furnish verbal or written statement establishing relevant prior work experience raising queen bees and extracting honey.
Must be able to lift/carry 60 lbs. Work on feet all day every day. Must not bee allergic to bee stings. 
5 or 6 days a week, Saturday work required when requested. You may be requested to work on Sundays and 3 U.S. holidays: Memorial day, July 4, and labor day. Workers will not be required to work on their sabbath.","Apicultura comercial; Cría abejas reinas. Cosecha y extrae miel. Alimentar y medicar las colmenas.
Raspe los marcos. Construya equipos de pintura y reparación. 
El trabajo requiere un mínimo de 6 meses de experiencia agrícola trabajando en una granja de abejas melíferas, manejando tareas manuales y mecanizadas con precisión y eficiencia. 
Los solicitantes deben ser capaces de proporcionar una declaración verbal o escrita que establezca la experiencia laboral previa relevante en la cría de abejas reinas y la extracción de miel.
Debe ser capaz de levantar/transportar 60 libras. Trabaje en los pies todo el día, todos los días. No debe ser alérgico a las picaduras de abeja. 
5 o 6 días a la semana, se requiere trabajo los sábados cuando se solicite. Es posible que se le pida que trabaje los domingos y 3 días festivos de los EE. UU.: Día de los Caídos, 4 de julio y Día del Trabajo. Los obreros no estarán obligados a trabajar en su día de reposo.",44.0,8,0.0,17.62,0.0,0.0,True,7:00 A.M.,3:30 P.M.,2026-01-06T00:00:00Z,2026-10-15T00:00:00Z,True,6,"Tools and clothes necessary for the job are supplied at no cost. 
Employer will comply with OAR 437-002-0156, OAR 437-00300005 and OAR 437-007-004 for prevention of heat illness. And provide training to workers about heat illness prevention.","Las herramientas y la ropa necesarias para el trabajo se suministran sin costo alguno. 
El empleador cumplirá con OAR 437-002-0156, OAR 437-00300005 y OAR 437-007-004 para la prevención de enfermedades causadas por el calor. Y proporcionar capacitación a los trabajadores sobre la prevención de enfermedades causadas por el calor.",False,0,None,,Month,Queen Bee Honey Company,Queen Bee Honey Company,Corvallis,OREGON,97333,+15417534120,,queenbeehoney.kf@gmail.com,115112,,H-2A,False,25114 Alpine Rd ,discretionary bonuses may be available.,Es posible que haya bonificaciones discrecionales disponibles.,,monroe,OREGON,97456,2025-12-02T00:00:00Z,1970-01-01T00:00:00Z,45-2093.00,"Farmworkers, Farm, Ranch, and Aquacultural Animals",,"{'type': 'Point', 'coordinates': [-123.30751, 44.315987], 'crs': {'type': 'name', 'properties': {'name': 'EPSG:4326'}}}",True,jobs.queenbeehoney@gmail.com,+15417534120,N/A,True,336,True,38741832,2025-12-08T16:30:42.267Z,0,2026-05-27T00:00:00Z,2025-12-02T15:52:58Z,0.0,,,False,False,2
4.9639196,25356259,Determination Issued - Certification,False,True,H-400-25305-356259,,,35-3023.00 Fast Food & Counter Workers – Mobile Food Concess,35-3023.00 Trabajadores de Comida Rápida y Mostrador – Contrato Móvil de Alimentos,"Perform variety of attending duties at mobile food concession.  Arrange tables and decorations according to instructions.  Communicate with customers regarding orders.  Accept payment from customers.  Serve food, beverages or desserts to customers.  Prepare daily food items and cook simple foods and beverages using proper safety precautions and safety measures. Clean & organize eating, service, and kitchen areas.  Perform cleaning duties to keep equipment and facilities sanatory.","Realizar una variedad de tareas de asistencia en la concesión de comida móvil.  Organice las mesas y las decoraciones de acuerdo con las instrucciones.  Comunícate con los clientes con respecto a los pedidos.  Acepte el pago de los clientes.  Servir comida, bebidas o postres a los clientes.  Prepare los alimentos diarios y cocine alimentos y bebidas simples utilizando las precauciones de seguridad y las medidas de seguridad adecuadas. Limpie y organice las áreas de comedor, servicio y cocina.  Realizar tareas de limpieza para mantener el equipo y las instalaciones sanitarias.",40.0,20,16.17,10.55,0.0,0.0,True,1:00 P.M.,10:00 P.M.,2026-01-06T00:00:00Z,2026-11-04T00:00:00Z,False,0,"Post-employment random drug testing and background checks may be required, at no cost to the worker. The job requires the applicant to be qualified, ready, willing, able, and available to perform during the entire employment at the designated worksites; and to follow workplace rules.
","Es posible que se requieran pruebas de drogas aleatorias posteriores al empleo y verificaciones de antecedentes, sin costo para el trabajador. El trabajo requiere que el solicitante esté calificado, listo, dispuesto, capaz y disponible para desempeñarse durante todo el empleo en los lugares de trabajo designados; y seguir las reglas del lugar de trabajo.
",False,0,None,,Hour,Louis & Claire Concessions LLC,,Austin,TEXAS,78702,+15126192510,,katpetree@gmail.com,71399,,H-2B,True,172 HWY 21 W,"No overtime expected. Overtime, if any, calculated and paid as per applicable regulations.","No se esperan horas extras. Horas extras, si las hubiera, calculadas y pagadas según la normativa aplicable.",,Cedar Creek,TEXAS,78612,2025-11-06T00:00:00Z,1970-01-01T00:00:00Z,35-2011.00,"Cooks, Fast Food",,"{'type': 'Point', 'coordinates': [-97.483665, 30.100954], 'crs': {'type': 'name', 'properties': {'name': 'EPSG:4326'}}}",True,katpetree@gmail.com,+15126192510,N/A,True,1601,True,38925392,2025-12-16T20:10:35.468Z,,2025-12-16T00:00:00Z,2025-11-06T16:07:16Z,0.0,,,False,False,2
