4.9639196,25422150,Determination Issued - Certification,True,True,H-300-25309-377594,,H-2A Wage,Farmworker,Trabajador agrícola,"Crops/Commodities: 
cattle, hay, grass, hay. 
Perform manual and/or mechanized duties associated with the breeding, care, and raising of cattle on a ranch. Feed and water livestock. Herd livestock to pasture for grazing.  Herd animals into corral and/or stall. Manually restrain animal. Maintain/repair fences used to contain herd animals. Install/maintain irrigation systems and water lines. Move and install irrigation pipes and equipment. Dig and maintain ditches.  Install and remove levee gates. Apply pesticides, herbicides, fungicides, and other crop protectants. Apply fertilizers, plant growth chemicals, conditioners, and other plant related treatments at the correct times depending on plant type, growth, climate and crop conditions. Mow, cut, and weed fields. Perform ditching, shoveling, hoeing, hauling, ground preparation, and other manual tasks.  Bending, stooping and kneeling required. Use hand tools including but not limited to hoes, shovels, shears, clippers, loppers, and saws. Lift, carry, and load/unload products or supplies. Assist with farm building/field maintenance and repairs. Repair fences.

Must wear assigned personal protective equipment when required. Must report for work daily wearing work clothing and boots or other durable foot wear. Workers wearing clothing inappropriate for work will not be permitted to start work.

Outdoor work required when plants are wet, or during light rain, snow, moderate winds, direct sun, high humidity and extreme temperatures.  Temperatures in fields during working hours may vary. Workers may be required to work during occasional showers not severe enough to stop field operations.

Allergies to ragweed, goldenrod, honey bees, insecticides, herbicides, fungicides, or related chemicals may affect a worker's ability to perform the job. Work is done outdoors for long periods of time and requires prolonged periods of standing and/or walking, repetitive movements, and frequent bending and/or stooping. Workers must be able to handle, lift, and carry heavy or bulky objects (product, containers) in accordance with the specified lifting requirements. 

Workers with a clean driving record (no major moving violations such as but not limited to Driving While Intoxicated or Reckless Driving) and able to obtain an insurable driver's license may drive company vehicles. Workers with appropriate licenses and a valid doctor's certificate may transport other workers. The vehicles provided to workers (van, SUVs, pick-up truck, etc.) are for multi-purpose use on an as-needed basis (e.g., driving workers from employer-provided housing directly to the farm, around the farm properties during the work day, possibly carrying equipment/supplies with them). This may require workers to operate the vehicles on public roads in order to reach the other locations (no CDL w/ passenger endorsement required). These multi-purpose vehicles have a capacity or less than 13 tons, may be used on or off-farm by the workers (e.g., drive to the grocery store, bank, etc. at their discretion). Workers are not required or expected to arrange for the routine pick-up of other workers or groups of workers on a regular schedule or planned basis (e.g., at housing locations or centralized pick-up points).

Supervisor(s) will provide instructions and directions to workers.  Workers must be able to comprehend and follow instructions and communicate effectively to supervisors.  Unusual, complex or non-routine activities will be supervised.  Workers expected to perform basic duties in a proficient manner without close supervision. 
 
Employer may request, but not require, workers to work more than the stated daily hours and/or on a worker's Sabbath or federal holidays. Worker must report to work at designated time and place each day. Daily or weekly work schedule may vary due to weather, sunlight, temperature, crop conditions, and other factors. Employer will notify workers of any change to start time.","Cultivos/Materias primas: 
ganado, heno, hierba, heno. 
Realizar tareas manuales y/o mecanizadas asociadas con la cría, el cuidado y la crianza del ganado en un rancho. Alimentar y abrevar al ganado. Arrear el ganado a pastar para el pastoreo.  Arrea los animales en corrales y/o establos. Sujetar manualmente al animal. Mantener/reparar las cercas utilizadas para contener a los animales del rebaño. Instalar/mantener sistemas de riego y líneas de agua. Mover e instalar tuberías y equipos de riego. Cavar y mantener zanjas.  Instale y retire las compuertas de los diques. Aplique pesticidas, herbicidas, fungicidas y otros protectores de cultivos. Aplique fertilizantes, productos químicos para el crecimiento de las plantas, acondicionadores y otros tratamientos relacionados con las plantas en los momentos correctos según el tipo de planta, el crecimiento, el clima y las condiciones del cultivo. Siega, corte y deshierbe los campos. Realice zanjas, palas, azadas, acarreos, preparación del suelo y otras tareas manuales.  Es necesario agacharse, agacharse y arrodillarse. Use herramientas manuales que incluyen, entre otras, azadas, palas, tijeras, tijeras, tijeras, tijeras de podar y sierras. Levantar, transportar y cargar/descargar productos o suministros. Ayudar con la construcción de granjas/mantenimiento y reparaciones de campos. Reparación de cercas.

Debe usar el equipo de protección personal asignado cuando sea necesario. Debe presentarse a trabajar todos los días con ropa de trabajo y botas u otro calzado duradero. Los trabajadores que usen ropa inapropiada para el trabajo no podrán comenzar a trabajar.

Se requiere trabajo al aire libre cuando las plantas están mojadas, o durante lluvias ligeras, nieve, vientos moderados, sol directo, alta humedad y temperaturas extremas.  Las temperaturas en los campos durante las horas de trabajo pueden variar. Es posible que se requiera que los trabajadores trabajen durante lluvias ocasionales que no sean lo suficientemente severas como para detener las operaciones de campo.

Las alergias a la ambrosía, la vara de oro, las abejas melíferas, los insecticidas, los herbicidas, los fungicidas o los productos químicos relacionados pueden afectar la capacidad de un trabajador para realizar el trabajo. El trabajo se realiza al aire libre durante largos períodos de tiempo y requiere períodos prolongados de pie y/o caminar, movimientos repetitivos y agacharse y/o agacharse frecuentemente. Los trabajadores deben ser capaces de manipular, levantar y transportar objetos pesados o voluminosos (productos, contenedores) de acuerdo con los requisitos de elevación especificados. 

Los trabajadores con un historial de manejo limpio (sin infracciones de tránsito importantes como, entre otras, conducir en estado de ebriedad o conducción imprudente) y capaces de obtener una licencia de conducir asegurable pueden conducir vehículos de la empresa. Los trabajadores con las licencias apropiadas y un certificado médico válido pueden transportar a otros trabajadores. Los vehículos proporcionados a los trabajadores (camionetas, SUV, camionetas, etc.) son para uso multipropósito según sea necesario (por ejemplo, llevar a los trabajadores desde la vivienda proporcionada por el empleador directamente a la granja, alrededor de las propiedades de la granja durante la jornada laboral, posiblemente llevando equipos/suministros con ellos). Esto puede requerir que los trabajadores operen los vehículos en las vías públicas para llegar a las otras ubicaciones (no se requiere CDL con endoso de pasajero). Estos vehículos multipropósito tienen una capacidad inferior a 13 toneladas, pueden ser utilizados dentro o fuera de la granja por los trabajadores (por ejemplo, conducir a la tienda de comestibles, al banco, etc. a su discreción). No se requiere ni se espera que los trabajadores organicen la recogida de rutina de otros trabajadores o grupos de trabajadores en un horario regular o planificado (por ejemplo, en ubicaciones de alojamiento o puntos de recogida centralizados).

Los supervisores proporcionarán instrucciones y direcciones a los trabajadores.  Los trabajadores deben ser capaces de comprender y seguir instrucciones y comunicarse eficazmente con los supervisores.  Las actividades inusuales, complejas o no rutinarias serán supervisadas.  Se espera que los trabajadores realicen tareas básicas de manera competente sin una estrecha supervisión. 
 
El empleador puede solicitar, pero no exigir, que los trabajadores trabajen más de las horas diarias establecidas y/o en un día de reposo del trabajador o días festivos federales. El trabajador debe presentarse a trabajar a la hora y lugar designados cada día. El horario de trabajo diario o semanal puede variar debido al clima, la luz solar, la temperatura, las condiciones del cultivo y otros factores. El empleador notificará a los trabajadores de cualquier cambio en la hora de inicio.",40.0,2,0.0,16.2,0.0,0.0,True,8:00 A.M.,4:30 P.M.,2026-01-06T00:00:00Z,2026-11-06T00:00:00Z,True,3,This job requires a minimum of 3 months of  agricultural field work experience handling both manual and mechanized  tasks including operating agricultural equipment associated with production of cattle. Applicants must be able to furnish verbal or written statement establishing relevant prior work experience. Must be able to lift/carry 60 lbs. Workers with clean driving record and/or insurable driver's license may be required to drive company vehicles.,"Este trabajo requiere un mínimo de 3 meses de experiencia en el campo agrícola, manejando tareas manuales y mecanizadas, incluida la operación de equipos agrícolas asociados con la producción de ganado. Los solicitantes deben ser capaces de proporcionar una declaración verbal o escrita que establezca la experiencia laboral previa relevante. Debe ser capaz de levantar/transportar 60 libras. Es posible que se requiera que los trabajadores con un historial de manejo limpio y/o una licencia de conducir asegurable conduzcan vehículos de la empresa.",False,0,None,,Hour,Frisco River Land & Cattle Company LLC,,Las Cruces,NEW MEXICO,88001,+15756212325,,friscoriverranch@gmail.com,1121,,H-2A,False,"33°30'10""N 108°53'01""W",US worker wage $16.20/hr; H2A worker wage $14.76,Salario de los trabajadores estadounidenses $16.20/hr; Salario del trabajador H2A $14.76,,Glenwood,NEW MEXICO,88039,2025-12-02T00:00:00Z,1970-01-01T00:00:00Z,45-2093.00,"Farmworkers, Farm, Ranch, and Aquacultural Animals",,"{'type': 'Point', 'coordinates': [-108.88113, 33.31355], 'crs': {'type': 'name', 'properties': {'name': 'EPSG:4326'}}}",True,friscoriverranch@gmail.com,+15756212325,N/A,True,470,True,38784632,2025-12-09T23:03:11.976Z,N/A,2026-06-07T00:00:00Z,2025-12-02T20:45:56Z,0.0,,,False,False,2
4.9639196,25361943,Determination Issued - Certification,False,False,H-400-25307-361943,,,Carnival Worker,Trabajador del Carnaval,"***RFI Response***
Regarding sell and serve food –Food and drink orders will be taken, sold, and served to customers at a concession stand window. 
Regarding the food preparation functions:
Prepare simple daily food items and beverages-typical carnival foods such as corn dogs, french/curly fries, twinkies, snickers and cheesecake, specialty gourmet candies, cotton candy, popcorn, funnel cakes, prepare turkey legs and barbeque meets for the smoker, following specific methods that usually require short preparation time. Using proper safety precautions and sanitary measures operate large-volume cooking equipment, such as grills, deep-fat fryers, griddles, poppers, smokers, or hot plates. Wash, cut, and prepare foods designated for cooking using knives or slicers. 

Regarding set up-stock/clean…tear down pack up stock and close down booth of food concessions and 
attend and maintain equipment functions:
Following simple specified instructions: Set up-Stock the booth with food items and equipment according to a provided check list. Using basic cleaning supplies such as Dawn, Windex, Mr. Clean, sanitizer tablets and following proper safety precautions and sanitary measures ensure all items are cleaned and stored in a specified safe manner for transportation. Setup and take down tools include: ladder, hammers, screw drivers. All required tools are provided. Attend and Maintain equipment by following simple specified 

***Original F.a.2***
Perform a variety of attending duties at amusement or recreation facility. Sell and collect tickets/fees, assist patrons; erect, take down, operate/attend amusement booths and maintain equipment; rides and games; make change; sell and serve food. Maintain inventories of equipment, storing/retrieving items and assembling/disassembling equipment as necessary. Monitor activities to ensure adherence to rules and safety procedures. Prepare food such as corn dogs, french/curly fries, twinkies, snickers and cheesecake, specialty gourmet candies, cotton candy, popcorn, funnel cakes, prepare turkey legs and barbeque meets for the smoker. Set up - stock/clean and ready for service, tear down - pack up stock and close down booth, heavy lifting and physically mobile, operate amusement rides, games and concession booths.","Respuesta a RFI***
Con respecto a la venta y servicio de alimentos: los pedidos de comida y bebida se tomarán, venderán y servirán a los clientes en una ventanilla de puesto de concesión. 
En cuanto a las funciones de preparación de alimentos:
Prepare alimentos y bebidas diarias simples: comidas típicas del carnaval como perros de maíz, papas fritas francesas / rizadas, twinkies, snickers y tarta de queso, dulces gourmet especiales, algodón de azúcar, palomitas de maíz, pasteles de embudo, prepare muslos de pavo y barbacoa para el fumador, siguiendo métodos específicos que generalmente requieren un tiempo de preparación corto. Usando las precauciones de seguridad y las medidas sanitarias adecuadas, opere equipos de cocina de gran volumen, como parrillas, freidoras, planchas, poppers, ahumadores o platos calientes. Lavar, cortar y preparar los alimentos designados para cocinar con cuchillos o rebanadoras. 

En cuanto a la configuración, el stock y la limpieza... derribar, empacar las existencias y cerrar el puesto de concesiones de alimentos y 
Asistir y mantener las funciones del equipo:
Siguiendo instrucciones simples especificadas: Configure: abastezca el puesto con alimentos y equipos de acuerdo con una lista de verificación proporcionada. El uso de suministros de limpieza básicos como Dawn, Windex, Mr. Clean, tabletas desinfectantes y el seguimiento de las precauciones de seguridad y las medidas sanitarias adecuadas garantizan que todos los artículos se limpien y almacenen de una manera segura especificada para el transporte. Las herramientas de montaje y desmontaje incluyen: escalera, martillos, destornilladores. Se proporcionan todas las herramientas necesarias. Atender y mantener el equipo siguiendo lo especificado simplemente. 

Original F.a.2***
Realizar una variedad de tareas de asistencia en el centro de diversión o recreación. Vender y recoger boletos/tarifas, ayudar a los clientes; montar, desmontar, operar/asistir a puestos de diversión y mantener el equipo; atracciones y juegos; hacer el cambio; vender y servir comida. Mantener inventarios de equipos, almacenar/recuperar artículos y montar/desmontar equipos según sea necesario. Supervisar las actividades para garantizar el cumplimiento de las normas y los procedimientos de seguridad. Prepare alimentos como perros de maíz, papas fritas francesas / rizadas, twinkies, snickers y tarta de queso, dulces gourmet especiales, algodón de azúcar, palomitas de maíz, pasteles de embudo, prepare muslos de pavo y barbacoa para el fumador. Configuración: existencias/limpiezas y listas para el servicio, desmontaje: empaque existencias y cierre la cabina, levante objetos pesados y se mueva físicamente, opere juegos mecánicos, juegos y puestos de concesión.",40.0,28,21.74,15.0,0.0,0.0,True,10:00 A.M.,7:00 P.M.,2026-01-06T00:00:00Z,2026-11-05T00:00:00Z,False,0,"The job requires that the applicant be qualified, ready, willing, able, and available to perform during the entire employment at the designated worksites under adverse weather; to enter into and comply with employment contracts; to follow workplace rules; and to meet job performance standards. Must comply with grooming requirements and dress code. Subject to discharge for cause. Must be willing to work up to 7days/wk. Post-employment/post-injury or incident and reasonable suspicion drug test required, cost paid by employer and applied equally to all workers, US and foreign/H2B. Applicants must cooperate with and complete job application and interview truthfully.
Post-employment background check and Post-employment/post-injury or incident and reasonable suspicion drug test required, cost paid by employer and applied equally to all workers, US and foreign/H2B.","El trabajo requiere que el solicitante esté calificado, listo, dispuesto, capaz y disponible para desempeñarse durante todo el empleo en los lugares de trabajo designados bajo condiciones climáticas adversas; celebrar y cumplir contratos de trabajo; seguir las reglas del lugar de trabajo; y cumplir con los estándares de desempeño laboral. Debe cumplir con los requisitos de aseo y el código de vestimenta. Sujeto a descargo por causa justificada. Debe estar dispuesto a trabajar hasta 7 días por semana. Se requiere una prueba de drogas posterior al empleo / posterior a la lesión o incidente y sospecha razonable, costo pagado por el empleador y aplicado por igual a todos los trabajadores, EE. UU. y extranjeros / H2B. Los solicitantes deben cooperar y completar la solicitud de empleo y la entrevista con sinceridad.
Verificación de antecedentes posterior al empleo y prueba de drogas posterior al empleo / posterior a la lesión o incidente y sospecha razonable requerida, costo pagado por el empleador y aplicado por igual a todos los trabajadores, EE. UU. y extranjeros / H2B.",False,0,None,,Hour,"Odyssey Foods, LLC",,Phoenix,ARIZONA,85044,+16027637194,,dominic@rcsfun.com,71399,,H-2B,True,1826 W McDowell Rd,See F.a.4,Véase F.a.4,,Phoenix,ARIZONA,85007,2025-11-17T00:00:00Z,1970-01-01T00:00:00Z,35-2015.00,"Cooks, Short Order",,"{'type': 'Point', 'coordinates': [-112.08702, 33.450394], 'crs': {'type': 'name', 'properties': {'name': 'EPSG:4326'}}}",False,N/A,+16027637194,azjobconnection.gov,True,1221,True,38824269,2025-12-11T14:51:32.97Z,,2025-12-16T00:00:00Z,2025-11-17T21:45:40Z,0.0,,,False,False,2
