@search.score,case_id,case_status,active,document_available,case_number,job_order_id,crop,job_title,job_title_es,job_duties,job_duties_es,work_hour_num_basic,total_positions,basic_rate_to,basic_rate_from,overtime_rate_to,overtime_rate_from,full_time,hourly_work_schedule_am,hourly_work_schedule_pm,begin_date,end_date,emp_experience_reqd,emp_exp_num_months,special_req,special_req_es,training_req,num_months_training,education_level,name_reqd_training,pay_range_desc,employer_business_name,employer_trade_name,employer_city,employer_state,employer_zip,employer_phone,employer_phone_ext,employer_email,naic_id,naic_description,visa_class,worksite_locations,worksite_address,add_wage_info,add_wage_info_es,worksite_address_alt,worksite_city,worksite_state,worksite_zip,accepted_date,affirmed_date,soc_code_id,soc_title,soc_description,coord,job_order_exists,apply_email,apply_phone,apply_url,oflc_cms,popularity,display,eventId,dhTimestamp,apply_extension,active_date,accepted_date_time,job_piece_rate,add_special_pay_info,add_special_pay_info_es,is_overtime_available,min_productivity,formVersionId
4.9639196,25386991,Determination Issued - Certification,True,True,H-300-25309-377235,,Wage offer for H-2A workers only is $12.00 per hour.,Agricultural Equipment Operators,Operadores de Equipos Agrícolas,"Multiple contract start dates available. Alternative start date(s) include the following:  1/6/26;  3/10/26
Crops/Commodities:  Potatoes. 
Driving tractors and planters, will plant,  cultivate, and harvest potatoes.  Workers will drive and operate one or more GPS equipped farm machines, such as tractors, sprayers, Bottom Switch plows, Grimme planters, Windrowers, line equipment with holding tanks, dry brushers, grading tables, harvesters, pumps, tilling equipment, holding tanks, case-loaders, pivots, pilers, windrowers, Dammer Dykes (cultivators) and other mechanized, electrically powered or motor-driven equipment, on farms or in farm equipment repair shops.  Workers will operate the farm machinery, equipment and vehicles.  Workers will be instructed in the safety and operation of the equipment before driving the equipment.  Workers will be expected to be able to operate equipment, with or without direction, in a manner that protects the operator, visitors, other employees, crops, trees, facilities and equipment.  Failure to comply with operating and safety standards may result in termination.  This is a very demanding and competitive business in which quality specifications must be rigorously adhered to.  The equipment workers will be operating and maintaining is expensive and dangerous.  Workers are expected to follow the employer's requests to not only prevent damage to the equipment, but to also prevent injuries to workers.  Any equipment damaged by a worker's failure to follow instructions or damaged due to malice will be charged to the worker.  
 
Workers may hitch soil conditioning implements, such as plow or harrow to tractor, and operate tractor and towed implement to furrow and grade soil.   Workers will drive tractors and operate designated towed machines, such as drill or manure spreader, to plant, fertilize and dust crops.  Prepares harvesting machine by adjusting speeds of cutters, blowers and conveyors and height of cutting head or depth of digging blades according to type, height, weight and condition of crop being harvested, and contour of terrain.  Attaches towed or mounted-type harvesting machine to tractor using hand tools or drives self-propelled harvesting machine to cut, pull up, dig, thresh, clean, chop, bag or bundle crops.  
 
Workers will perform irrigation activities, including setting up, moving and maintaining irrigation pipes and equipment.  

Adjusts and lubricates machines and equipment to ensure efficient operation.  
 
Workers will be required to prepare farm land for planting.  This includes removing trash, trees, stumps, rocks and any other debris or material that will interfere with planting and harvesting crops.  Workers will be required to dig ditches for the installation of pipe and to prevent erosion.  Workers may be required to pile the debris up for burning.  Workers may be required to operate rakes for root and limb removal.  Workers may operate dozers, tractors, front end loaders, bobcats and various other pieces of land clearing equipment.  Workers may be required to level land by moving dirt from one location to another using equipment.

Workers with a clean driving record (no major moving violations such as but not limited to Driving While Intoxicated or Reckless Driving) and possessing or able to obtain an insurable driver's license may drive company vehicles. Workers with appropriate licenses may transport other workers to and from employer-provided housing directly to worksites each day and may transport workers around farms during the workday, may transport crops, supplies, tools and/or equipment/supplies between employer's farm locations, on private or public roads. Workers do not deliver to customers. Workers may drive multi-purpose vehicles that have a capacity of less than 13 tons, require a standard driver's license to operate, and may be used on or off farm by the workers (e.g., drive to the grocery store, bank, etc. at their discretion).","Múltiples fechas de inicio de contrato disponibles. Las fechas de inicio alternativas incluyen las siguientes: 1/6/26;  3/10/26
Cultivos/Materias primas: Patatas. 
Conduciendo tractores y sembradoras, plantará, cultivará y cosechará papas.  Los trabajadores conducirán y operarán una o más máquinas agrícolas equipadas con GPS, como tractores, rociadores, arados Bottom Switch, sembradoras Grimme, hileradoras, equipos de línea con tanques de retención, cepilladores en seco, mesas de clasificación, cosechadoras, bombas, equipos de labranza, tanques de retención, cargadores de cajas, pivotes, apiladores, hileradores, diques Dammer (cultivadores) y otros equipos mecanizados, eléctricos o motorizados, en granjas o en talleres de reparación de equipos agrícolas.  Los trabajadores operarán la maquinaria, el equipo y los vehículos agrícolas.  Los trabajadores serán instruidos sobre la seguridad y el funcionamiento del equipo antes de conducirlo.  Se espera que los trabajadores puedan operar el equipo, con o sin dirección, de una manera que proteja al operador, los visitantes, otros empleados, los cultivos, los árboles, las instalaciones y el equipo.  El incumplimiento de las normas de funcionamiento y seguridad puede dar lugar a la rescisión.  Se trata de un negocio muy exigente y competitivo en el que hay que cumplir rigurosamente las especificaciones de calidad.  El equipo que los trabajadores operarán y mantendrán es costoso y peligroso.  Se espera que los trabajadores sigan las solicitudes del empleador no solo para evitar daños al equipo, sino también para evitar lesiones a los trabajadores.  Cualquier equipo dañado por el incumplimiento de las instrucciones por parte de un trabajador o dañado debido a malicia se cobrará al trabajador.  
 
Los trabajadores pueden enganchar implementos de acondicionamiento del suelo, como el arado o la grada al tractor, y operar el tractor y el implemento remolcado para surcar y nivelar el suelo.   Los trabajadores conducirán tractores y operarán máquinas remolcadas designadas, como perforadoras o esparcidoras de estiércol, para plantar, fertilizar y desempolvar cultivos.  Prepara la máquina cosechadora ajustando las velocidades de los cortadores, sopladores y transportadores y la altura del cabezal de corte o la profundidad de las cuchillas de excavación de acuerdo con el tipo, la altura, el peso y la condición del cultivo que se cosecha, y el contorno del terreno.  Conecta la máquina cosechadora de tipo remolcado o montado al tractor usando herramientas manuales o impulsa la máquina cosechadora autopropulsada para cortar, levantar, cavar, trillar, limpiar, cortar, embolsar o agrupar cultivos.  
 
Los trabajadores realizarán actividades de riego, incluida la instalación, el traslado y el mantenimiento de tuberías y equipos de riego.  

Ajusta y lubrica las máquinas y el equipo para garantizar un funcionamiento eficiente.  
 
Se requerirá que los trabajadores preparen las tierras agrícolas para la siembra.  Esto incluye la eliminación de basura, árboles, tocones, rocas y cualquier otro residuo o material que interfiera con la siembra y cosecha de cultivos.  Se requerirá que los trabajadores caven zanjas para la instalación de tuberías y para evitar la erosión.  Es posible que se requiera que los trabajadores apilen los escombros para quemarlos.  Es posible que se requiera que los trabajadores operen rastrillos para la remoción de raíces y ramas.  Los trabajadores pueden operar topadoras, tractores, cargadores frontales, gatos monteses y varios otros equipos de limpieza de tierras.  Es posible que se requiera que los trabajadores nivelen la tierra moviendo la tierra de un lugar a otro usando equipo.

Los trabajadores con un historial de manejo limpio (sin infracciones de tránsito importantes como, entre otras, conducir en estado de ebriedad o conducción imprudente) y que posean o puedan obtener una licencia de conducir asegurable pueden conducir vehículos de la empresa. Los trabajadores con las licencias apropiadas pueden transportar a otros trabajadores hacia y desde la vivienda proporcionada por el empleador directamente a los lugares de trabajo todos los días y pueden transportar trabajadores alrededor de las granjas durante la jornada laboral, pueden transportar cultivos, suministros, herramientas y / o equipos / suministros entre las ubicaciones de las granjas del empleador, en caminos privados o públicos. Los trabajadores no realizan entregas a los clientes. Los trabajadores pueden conducir vehículos multipropósito que tienen una capacidad de menos de 13 toneladas, requieren una licencia de conducir estándar para operar y pueden ser utilizados dentro o fuera de la granja por los trabajadores (por ejemplo, conducir a la tienda de comestibles, al banco, etc. a su discreción).",54.0,37,0.0,12.51,0.0,0.0,True,6:00 A.M.,3:30 P.M.,2026-01-06T00:00:00Z,2026-05-31T00:00:00Z,True,2,"This job requires a minimum of 3 months of verifiable prior experience performing duties associated with operating and performing routine maintenance on GPS equipped  potato farming equipment. Applicants must be able to furnish verifiable job reference(s) or comparable third party documentation from recent employer(s) establishing acceptable prior experience. Saturday work required. Must be able to lift/carry 60 lbs.  Employer-paid post-hire drug testing is required upon reasonable suspicion of use and after a worker has an accident at work.    Must be willing to work 1st, 2nd or 3rd shift hours.","Este trabajo requiere un mínimo de 3 meses de experiencia previa verificable en la realización de tareas asociadas con la operación y el mantenimiento de rutina en equipos de cultivo de papa equipados con GPS. Los solicitantes deben ser capaces de proporcionar referencias laborales verificables o documentación comparable de terceros de empleadores recientes que demuestren una experiencia previa aceptable. Se requiere trabajo los sábados. Debe ser capaz de levantar/transportar 60 libras.  Las pruebas de drogas posteriores a la contratación pagadas por el empleador son obligatorias ante una sospecha razonable de uso y después de que un trabajador tenga un accidente en el trabajo.    Debe estar dispuesto a trabajar en el 1º, 2º o 3º turno de horas.",False,0,None,,Hour,Walther Farms LLC - NM,,Three Rivers,MICHIGAN,49093,+12603168660,,h2a.info@waltherfarms.com,111211,,H-2A,False,"Shop/Office - 9987 NM-371  (36.644191, -108.229979)",Wage offer for H-2A workers only is $12.00 per hour,La oferta salarial solo para trabajadores H-2A es de $ 12.00 por hora,,Farmington,NEW MEXICO,87401,2025-11-24T00:00:00Z,1970-01-01T00:00:00Z,45-2091.00,Agricultural Equipment Operators,,"{'type': 'Point', 'coordinates': [-108.19294, 36.73861], 'crs': {'type': 'name', 'properties': {'name': 'EPSG:4326'}}}",True,h2a.info@waltherfarms.com,+12692782389,N/A,True,224,True,38682353,2025-12-04T13:37:56.582Z,N/A,2026-03-19T12:00:00Z,2025-11-24T20:02:54Z,0.0,,,False,False,2
4.9639196,25438915,Determination Issued - Certification,True,True,H-300-25317-406101,,,Farm Worker,Trabajador Agrícola,"Drive and control farm equipment and attached farm implements to plant, irrigate, cultivate, and harvest trees. Adjust, inspect, repair, and service farm machinery. Specifically, they will set up and operate irrigation equipment, operate mowers, fertilize soil, or plant, cultivate, spray, and harvest trees. They will repair and maintain farm vehicles, implements, and mechanical equipment; apply pesticides, herbicides, and fertilizers to trees; clear and maintain irrigation ditches; and report to farm owners/managers as needed. Manipulate controls to set, activate, and adjust mechanisms or machinery. Observe and listen to machinery operations to detect equipment malfunctions. Adjust, repair, and service farm machinery and notify supervisors when machinery malfunctions. Operate towed machines such as seed drills or manure spreaders to plant, fertilize, dust, and spray crops. Using hand sprayers, spray fertilizer or pesticide solutions to control insects, fungus and weed growth, and 
diseases. Mix specified materials or chemicals, and dump solutions, powders, or seeds into planter or sprayer machinery. Irrigate soil using portable pipes or ditch systems, and maintain ditches, pipes, and pumps.
","Conduzca y controle el equipo agrícola y los implementos agrícolas adjuntos para plantar, regar, cultivar y cosechar árboles. Ajustar, inspeccionar, reparar y dar servicio a la maquinaria agrícola. Específicamente, instalarán y operarán equipos de riego, operarán cortadoras de césped, fertilizarán el suelo o plantarán, cultivarán, rociarán y cosecharán árboles. Ellos repararán y mantendrán vehículos agrícolas, implementos y equipos mecánicos; aplicar pesticidas, herbicidas y fertilizantes a los árboles; limpiar y mantener las acequias; e informar a los propietarios/administradores de granjas según sea necesario. Manipule los controles para configurar, activar y ajustar mecanismos o maquinaria. Observe y escuche las operaciones de la maquinaria para detectar el mal funcionamiento de los equipos. Ajustar, reparar y dar servicio a la maquinaria agrícola y notificar a los supervisores cuando la maquinaria funcione mal. Opere máquinas remolcadas, como sembradoras o esparcidores de estiércol, para plantar, fertilizar, desempolvar y rociar cultivos. Usar rociadores manuales, rociar soluciones de fertilizantes o pesticidas para controlar el crecimiento de insectos, hongos y malezas, y 
Enfermedades. Mezcle materiales o productos químicos especificados y vierta soluciones, polvos o semillas en la maquinaria de la sembradora o rociadora. Riegue el suelo usando tuberías portátiles o sistemas de zanjas, y mantenga zanjas, tuberías y bombas.
",40.0,12,0.0,11.81,0.0,0.0,True,8:00 A.M.,5:00 P.M.,2026-01-06T00:00:00Z,2026-10-06T00:00:00Z,False,0,"Alcohol, drug testing, and criminal background checks may be conducted post-hire at employer's expense and are not part of the interview process. All workers may be subject to mandatory testing if they have been involved in a reportable accident or upon reasonable suspicion that drug use is impacting job performance. Because workers use expensive, heavy agriculture equipment, any worker with recent a criminal conviction for DWI or property crimes will be terminated. ","Las pruebas de alcohol, drogas y antecedentes penales pueden realizarse después de la contratación a expensas del empleador y no forman parte del proceso de entrevista. Todos los trabajadores pueden estar sujetos a pruebas obligatorias si han estado involucrados en un accidente reportable o si se sospecha razonablemente que el uso de drogas está afectando el desempeño laboral. Debido a que los trabajadores utilizan equipos agrícolas costosos y pesados, cualquier trabajador con una condena penal reciente por DWI o delitos contra la propiedad será despedido. ",False,0,None,,Hour,"JLH Farms, LLC",,La Grange,TEXAS,78945,+19799660244,,sales@txbrs.com,111421,,H-2A,False,341 Bordovsky Rd,The wage offer for H-2A workers is $9.97 per hour.,La oferta salarial para los trabajadores H-2A es de $9.97 por hora.,,La Grange,TEXAS,78945,2025-12-05T00:00:00Z,1970-01-01T00:00:00Z,45-2091.00,Agricultural Equipment Operators,,"{'type': 'Point', 'coordinates': [-96.87783, 29.915943], 'crs': {'type': 'name', 'properties': {'name': 'EPSG:4326'}}}",True,john@txbrs.com,+19799660244,N/A,True,320,True,38844930,2025-12-12T11:37:47.89Z,N/A,2026-05-22T12:00:00Z,2025-12-05T14:19:09Z,0.0,,,False,False,2
4.9639196,25446248,Determination Issued - Certification,True,True,H-300-25328-431960,,,General Farm Worker,Trabajador Agrícola General,"Employees will operate equipment with towed feeder wagon implements designated for feeding and bedding cattle. They will observe cattle for sicknesses and treat  if needed. They will grind feed, vaccinate, brand and tag ears of the animals. Assist with calving the herd and care for new born.  Check pens  for water, cleanness and health conditions of the animals.  They will grind feed, vaccinate, brand and tag ears of the animals. Fixing and mending existing fences, routine maintenance will need to be done on machinery, grounds and structures.
 Must be able to work independently after given instructions. 

Employees must speak, read, write and understand English language for record keeping and safety reasons.
Cell phones are limited to business calls only. No Texting. No smoking or drinking of alcoholic beverages during working hours.

Must have a current drivers license or capable of obtaining one in 30 days.
Workers must have three months tractor driving with computerized monitors experience and cattle experience. Must be able to lift 50 pounds. 

 ","Los empleados operarán equipos con implementos de vagones alimentadores remolcados designados para alimentar y amarrar al ganado. Observarán al ganado en busca de enfermedades y tratarán si es necesario. Molerán el alimento, vacunarán, marcarán y marcarán las orejas de los animales. Ayudar con el parto del rebaño y cuidar a los recién nacidos.  Revise el agua, la limpieza y las condiciones de salud de los animales en los corrales.  Molerán el alimento, vacunarán, marcarán y marcarán las orejas de los animales. Al arreglar y reparar las cercas existentes, será necesario realizar un mantenimiento de rutina en maquinaria, terrenos y estructuras.
 Debe ser capaz de trabajar de forma independiente después de las instrucciones dadas. 

Los empleados deben hablar, leer, escribir y entender el idioma inglés por razones de seguridad y mantenimiento de registros.
Los teléfonos celulares están limitados solo a llamadas comerciales. No se permiten mensajes de texto. No fumar ni beber bebidas alcohólicas durante las horas de trabajo.

Debe tener una licencia de conducir vigente o capaz de obtener una en 30 días.
Los trabajadores deben tener tres meses de conducción de tractores con experiencia en monitores computarizados y experiencia en ganado. Debe ser capaz de levantar 50 libras. 

",40.0,2,0.0,18.98,0.0,0.0,True,8:00 A.M.,5:00 P.M.,2026-01-06T00:00:00Z,2026-03-31T00:00:00Z,True,3,"Required  current driver's license or capable of obtaining one in 30 days.
Workers must have three months tractor driving with computerized monitors experience and
 cattle experience. 
Must be able to lift 50 pounds.
Speak, read, write and understand English language for record keeping and safety reasons.","Se requiere una licencia de conducir vigente o capaz de obtener una en 30 días.
Los trabajadores deben tener tres meses de conducción de tractores con monitores computarizados, experiencia y
 experiencia ganadera. 
Debe ser capaz de levantar 50 libras.
Hablar, leer, escribir y comprender el idioma inglés por razones de seguridad y mantenimiento de registros.",False,0,None,,Hour,Levi Lenton,Lenton Farms,Norwich,NORTH DAKOTA,58768,+17015007898,,lentonfarms@gmail.com,115115,,H-2A,False,5612 20th Ave NE,,,,Norwich,NORTH DAKOTA,58768,2025-12-11T00:00:00Z,1970-01-01T00:00:00Z,45-2092.00,"Farmworkers and Laborers, Crop, Nursery, and Greenhouse",,"{'type': 'Point', 'coordinates': [-100.98866, 48.246258], 'crs': {'type': 'name', 'properties': {'name': 'EPSG:4326'}}}",True,lentonfarms@gmail.com,+17015007898,www.jobsnd.com,True,248,True,38984942,2025-12-18T21:36:33.909Z,0,2026-02-17T00:00:00Z,2025-12-11T22:19:34Z,0.0,,,False,False,2
4.9639196,25391206,Determination Issued - Certification,True,True,H-300-25305-356038,,Livestock,Livestock Worker,Trabajador Ganadero,"Job requires tending to livestock in the forms of feeding, examining, tagging, spraying for flies/pests, assisting with vet visits, assisting with medication administration, and herding cattle. Calving duties include calving cows and bred heifers, occasionally lifting and carrying newborn calves, and weaning calves from cows. Employees will be operating various equipment including, but not limited to, tractors, front loaders, mowers, balers, and trucks with gooseneck cattle trailers connected. Duties include planting grass, tilling pasture, and cleaning pens conducting the repair and maintenance of farm equipment and fencing, regularly cleaning and servicing equipment, mixing feed, and lifting bags of mineral and hay bales. There are few typical days and workers may be required to change duties and engage in various general functions. Daily duties may vary. The employer reserves the right to increase workers' pay or provide bonuses based on tenure, performance, or other factors that are solely based on the discretion of the employer.","El trabajo requiere cuidar el ganado en las formas de alimentación, examen, etiquetado, fumigación contra moscas / plagas, ayudar con las visitas al veterinario, ayudar con la administración de medicamentos y pastorear el ganado. Las tareas de parto incluyen el parto de vacas y novillas reproductoras, el levantamiento y transporte ocasional de terneros recién nacidos y el destete de terneros de vacas. Los empleados operarán varios equipos, incluidos, entre otros, tractores, cargadores frontales, cortadoras de césped, empacadoras y camiones con remolques de ganado de cuello de cisne conectados. Los deberes incluyen plantar pasto, labrar pastos y limpiar corrales, realizar la reparación y el mantenimiento de equipos agrícolas y cercas, limpiar y dar servicio regularmente al equipo, mezclar alimentos y levantar bolsas de pacas de mineral y heno. Hay pocos días típicos y es posible que se requiera que los trabajadores cambien de tarea y participen en diversas funciones generales. Las tareas diarias pueden variar. El empleador se reserva el derecho de aumentar el salario de los trabajadores o proporcionar bonificaciones en función de la antigüedad, el rendimiento u otros factores que se basan únicamente en la discreción del empleador.",45.0,1,0.0,16.28,0.0,0.0,True,7:00 A.M.,2:30 P.M.,2026-01-06T00:00:00Z,2026-02-25T00:00:00Z,True,3,"Job requires having or being able to obtain a driver's license within 30 days of hire. Job will require workers performing duties outdoors during periods of light rain, heat, cold, or other conditions that would not prevent work from being performed. Job duties will require periods when workers will push, pull, sit, or walk for extended periods.","El trabajo requiere tener o poder obtener una licencia de conducir dentro de los 30 días posteriores a la contratación. El trabajo requerirá que los trabajadores realicen tareas al aire libre durante períodos de lluvia ligera, calor, frío u otras condiciones que no impidan que se realice el trabajo. Los deberes laborales requerirán períodos en los que los trabajadores empujarán, tirarán, se sentarán o caminarán durante períodos prolongados.",False,0,None,,Hour,Ruben Richardson Farm,,Yuma,COLORADO,80759,+19706301990,,rubenrich1@hotmail.com,1111,,H-2A,False,41564 CR J,,,,Yuma,COLORADO,80759,2025-11-24T00:00:00Z,1970-01-01T00:00:00Z,45-2093.00,"Farmworkers, Farm, Ranch, and Aquacultural Animals",,"{'type': 'Point', 'coordinates': [-102.71571, 40.134174], 'crs': {'type': 'name', 'properties': {'name': 'EPSG:4326'}}}",True,rubenrich1@hotmail.com,+19706301990,N/A,True,341,True,38562649,2025-11-26T18:15:30.237Z,N/A,2026-01-31T00:00:00Z,2025-11-24T12:27:05Z,0.0,,,False,False,2
