4.9639196,25393641,Determination Issued - Certification,True,True,H-300-25307-361970,,,Nursery Worker,Trabajador en Vivero de Plantas,"Crops/Commodities: 
Ornamental Plant Nursery. 
Perform manual and mechanized tasks associated with the production of greenhouse plants and other horticultural products. Plant, cultivate, and maintain nursery stock, trees, shrubs, bedding plants, plugs, liners, hanging baskets, and other horticultural varieties. Propagate plants from cuttings. Plant/pot seedlings, fill and label trays, move product to/from greenhouses, fields, and/or loading/unloading areas. Crimp wire baskets. Attach hangers to baskets and hang throughout holding houses. Move containerized plants using rolling/electric carts. Unload/load trucks and product from conveyor belt. Install/remove plastic coverings. Clean/maintain work area.
Prune, trim, and perform other general plant maintenance. Water or irrigate plants and apply fertilizer or other chemicals. Maintain irrigation systems. Tie/position plants by tying or wrapping as necessary. Wrap plants with burlap and other coverings as necessary. Count, inventory, and grade plants and trees. Pack, label, tag, pull, sort, and store plants by variety. 
Install/maintain irrigation and water lines. Move and install irrigation pipes and equipment.
Apply pesticides, herbicides, fungicides, and other crop protectants. Apply fertilizers, plant growth chemicals, conditioners, and other plant related treatments at the correct times depending on plant type, growth, climate and crop conditions.
Workers must operate all equipment properly and in a manner that protects operator, others, the employer's products and property.  Failure to comply with safety requirements and operating instructions may result in disciplinary action up to and including immediate termination.
Mow, cut, and weed fields. Perform ditching, shoveling, hoeing, hauling, ground preparation, and other manual tasks.  Bending, stooping and kneeling required. Use hand tools including but not limited to hoes, shovels, shears, clippers, loppers, and saws. Lift, carry, and load/unload products or supplies. Assist with farm building/field maintenance and repairs. Repair fences.
Must wear assigned personal protective equipment when required. Must report for work daily wearing work clothing and boots or other durable foot wear. Workers wearing clothing inappropriate for work will not be permitted to start work.
Outdoor work required when plants are wet, or during light rain, snow, moderate winds, direct sun, high humidity and extreme temperatures.  Temperatures in fields during working hours may vary. Workers may be required to work during occasional showers not severe enough to stop field operations. Work is done outdoors for long periods of time and requires prolonged periods of standing and/or walking, repetitive movements, and frequent bending and/or stooping. Workers must be able to handle, lift, and carry heavy or bulky objects (product, containers) in accordance with the specified lifting requirements. 
Employer-paid post-hire drug testing is required after a worker has an accident at work. 
Supervisor(s) will provide instructions and directions to workers.  Workers must be able to comprehend and follow instructions and communicate effectively to supervisors.  Unusual, complex or non-routine activities will be supervised.  Workers expected to perform basic duties in a proficient manner without close supervision.
Workers with a clean driving record (no major moving violations such as but not limited to Driving While Intoxicated or Reckless Driving) and able to obtain an insurable driver's license may drive company vehicles. Workers with appropriate licenses may transport other workers to-and-from James Greenhouses provided housing directly to worksites each day and transporting workers around James Greenhouses' property during the workday and possibly carrying equipment/supplies and this may involve the worker(s) operating the vehicles across public roads in order to reach the other farm properties to perform their work.","Cultivos/Materias primas: 
Vivero de plantas ornamentales. 
Realizar tareas manuales y mecanizadas asociadas con la producción de plantas de invernadero y otros productos hortícolas. Plante, cultive y mantenga material de vivero, árboles, arbustos, plantas de arriate, tapones, revestimientos, cestas colgantes y otras variedades hortícolas. Propagar plantas a partir de esquejes. Plante plántulas / macetas, llene y etiquete bandejas, mueva el producto hacia / desde invernaderos, campos y / o áreas de carga / descarga. Cestas de alambre engarzado. Fije las perchas a las cestas y cuélguelas en todas las casas de retención. Mueva plantas en contenedores utilizando carros rodantes/eléctricos. Descargar/cargar camiones y productos de la cinta transportadora. Instale/retire las cubiertas de plástico. Limpiar/mantener el área de trabajo.
Podar, recortar y realizar otros mantenimientos generales de la planta. Riegue o riegue las plantas y aplique fertilizantes u otros productos químicos. Mantener los sistemas de riego. Amarre / coloque las plantas atándolas o envolviéndolas según sea necesario. Envuelva las plantas con arpillera y otras cubiertas según sea necesario. Contar, inventariar y clasificar plantas y árboles. Empaque, etiquete, etiquete, extraiga, clasifique y almacene plantas por variedad. 
Instalar/mantener líneas de riego y agua. Mover e instalar tuberías y equipos de riego.
Aplique pesticidas, herbicidas, fungicidas y otros protectores de cultivos. Aplique fertilizantes, productos químicos para el crecimiento de las plantas, acondicionadores y otros tratamientos relacionados con las plantas en los momentos correctos según el tipo de planta, el crecimiento, el clima y las condiciones del cultivo.
Los trabajadores deben operar todo el equipo correctamente y de una manera que proteja al operador, a los demás, los productos y la propiedad del empleador.  El incumplimiento de los requisitos de seguridad y las instrucciones de funcionamiento puede dar lugar a medidas disciplinarias que pueden incluir la rescisión inmediata.
Siega, corte y deshierbe los campos. Realice zanjas, palas, azadas, acarreos, preparación del suelo y otras tareas manuales.  Es necesario agacharse, agacharse y arrodillarse. Use herramientas manuales que incluyen, entre otras, azadas, palas, tijeras, tijeras, tijeras, tijeras de podar y sierras. Levantar, transportar y cargar/descargar productos o suministros. Ayudar con la construcción de granjas/mantenimiento y reparaciones de campos. Reparación de cercas.
Debe usar el equipo de protección personal asignado cuando sea necesario. Debe presentarse a trabajar todos los días con ropa de trabajo y botas u otro calzado duradero. Los trabajadores que usen ropa inapropiada para el trabajo no podrán comenzar a trabajar.
Se requiere trabajo al aire libre cuando las plantas están mojadas, o durante lluvias ligeras, nieve, vientos moderados, sol directo, alta humedad y temperaturas extremas.  Las temperaturas en los campos durante las horas de trabajo pueden variar. Es posible que se requiera que los trabajadores trabajen durante lluvias ocasionales que no sean lo suficientemente severas como para detener las operaciones de campo. El trabajo se realiza al aire libre durante largos períodos de tiempo y requiere períodos prolongados de pie y/o caminar, movimientos repetitivos y agacharse y/o agacharse frecuentemente. Los trabajadores deben ser capaces de manipular, levantar y transportar objetos pesados o voluminosos (productos, contenedores) de acuerdo con los requisitos de elevación especificados. 
Las pruebas de drogas posteriores a la contratación pagadas por el empleador son obligatorias después de que un trabajador tiene un accidente en el trabajo. 
Los supervisores proporcionarán instrucciones y direcciones a los trabajadores.  Los trabajadores deben ser capaces de comprender y seguir instrucciones y comunicarse eficazmente con los supervisores.  Las actividades inusuales, complejas o no rutinarias serán supervisadas.  Se espera que los trabajadores realicen tareas básicas de manera competente sin una estrecha supervisión.
Los trabajadores con un historial de manejo limpio (sin infracciones de tránsito importantes como, entre otras, conducir en estado de ebriedad o conducción imprudente) y capaces de obtener una licencia de conducir asegurable pueden conducir vehículos de la empresa. Los trabajadores con las licencias apropiadas pueden transportar a otros trabajadores hacia y desde los Invernaderos James directamente a los lugares de trabajo todos los días y transportar a los trabajadores alrededor de la propiedad de los Invernaderos James durante la jornada laboral y posiblemente llevar equipos / suministros, y esto puede implicar que los trabajadores operen los vehículos a través de las carreteras públicas para llegar a las otras propiedades agrícolas para realizar su trabajo.",44.0,6,0.0,12.27,0.0,0.0,True,8:00 A.M.,4:30 P.M.,2026-01-06T00:00:00Z,2026-10-29T00:00:00Z,True,2,"This job requires a minimum of 2 months of  agricultural experience working in a greenhouse or nursery handling tasks associated with ornamental plant production. Applicants must be able to furnish verbal or written statement establishing relevant prior work experience. Saturday work required. Must be able to lift/carry 60  lbs. Employer-paid post-hire drug testing is required after a worker has an accident at work. Duties include working in varied temperatures, extensive sitting or walking, and frequent stooping or bending.","Este trabajo requiere un mínimo de 2 meses de experiencia agrícola trabajando en un invernadero o vivero manejando tareas asociadas con la producción de plantas ornamentales. Los solicitantes deben ser capaces de proporcionar una declaración verbal o escrita que establezca la experiencia laboral previa relevante. Se requiere trabajo los sábados. Debe ser capaz de levantar/transportar 60 libras. Las pruebas de drogas posteriores a la contratación pagadas por el empleador son obligatorias después de que un trabajador tiene un accidente en el trabajo. Los deberes incluyen trabajar en temperaturas variadas, estar sentado o caminar mucho tiempo y agacharse o agacharse con frecuencia.",False,0,None,,Hour,"James Greenhouses, LLC",,Colbert,GEORGIA,30628,+16784271488,,bheavern@jamesgreenhouses.com,1114,,H-2A,False,1699 Crawford Smithonia Rd,Wage offer for H-2A workers only is $10.52 per hour,La oferta salarial solo para trabajadores H-2A es de $10.52 por hora,,Colbert,GEORGIA,30628,2025-11-18T00:00:00Z,1970-01-01T00:00:00Z,45-2092.00,"Farmworkers and Laborers, Crop, Nursery, and Greenhouse",,"{'type': 'Point', 'coordinates': [-83.21956, 34.042267], 'crs': {'type': 'name', 'properties': {'name': 'EPSG:4326'}}}",True,info@jamesgreenhouses.com,+17067427802,N/A,True,204,True,38510157,2025-11-24T17:58:30.232Z,N/A,2026-06-03T00:00:00Z,2025-11-18T17:35:54Z,0.0,,,False,False,2
4.9639196,25397384,Determination Issued - Certification,True,True,H-300-25307-362463,,,Nursery Worker,Trabajador en Vivero de Plantas,"Crops/Commodities: 
trees. 
This job requires a minimum of two months of prior experience working in a nursery handling both manual and machine tasks associated with balled and burlap tree production and harvest activities. Workers must be able to perform manual as well as mechanized activities with accuracy and efficiency. Workers performing tasks in each of the following specific areas will be required to maintain the quality and pace of work as directed by the Team Leader.  The Production Manager (Team Leader) will provide instructions and general supervision to the worker(s).  However, workers will be expected to perform their duties in a timely and proficient manner without close supervision.  

Nursery work specifications can change from time to time during the season due to weather and market conditions. Workers will be expected to conform to the specific instructions given for each day's work.  
 
Pruning:
Responsible for pruning field grown plant material. Development of hand/eye coordination for pruning with hand shears, pole pruners and loppers is required. Work will require workers to climb ladders to perform tasks.  

Planting:
Responsible for planting field grown plant material. Workers must be able to use a shovel and be able to physically perform the required task. Workers must be conscious of the importance of getting young trees from the holding facility to the field and planted expeditiously to maximize the tree survival and growth. Proper consideration must be made for the proper planting depth and planting procedures.  

Staking:
Responsible for staking field grown plant material, which involves forcing a stake into the ground next to a tree and using staking tape to tape the tree to the stake to ensure proper growth. This will also include removal of stakes by use of pipe wrench or stake puller to loosen stake prior to removing by hand after period of time set forth by management.  

Harvesting/Loading:
Responsible for harvesting field grown plant material. Workers will be responsible for developing a knowledge and understanding of appropriate harvesting supplies including baskets, burlap, nails, crimpers, proper strapping and their locations in order to harvest trees. Workers must be able to utilize the proper strapping methods for different root balls as well as be able to assist others if needed. Will also be required to assist in loading extracted plant material onto trucks for transport to distribution area.  

Clearing:
Responsible for clearing fields in preparation for planting. Workers will be responsible for picking up root pieces, rocks, trees & other debris left behind after clearing and placing debris into a loader bucket or designated debris area on the field for removal or burning.  

General Nursery Work:
Workers may be required to assist in the maintenance and possible reparation of greenhouses and other nursery structures as needed. In addition, workers may be required to perform variable tasks such as the following: irrigation, ditching, shoveling, hoeing, hauling, ground preparation, weeding and other tasks related to a nursery operation.

Equipment:
Workers may be required to operate different types of equipment used in the tree farming process, including but not limited to: Skid Steers, Boom Lifts, Brownie Lifts, ZTR Mowers, Weed Eaters, Kawasaki Mules and chain saws as well as daily use field trucks and tractors. Workers will be expected to be able to operate agricultural equipment with or without direction. 
 
Work is to be done in the field for long periods of time. Workers will assist in loading trucks with product weighing up to and including 60 pounds and lifting to a height of 5 feet for long periods of time. Workers should be able to work on their feet in bent positions for long periods of time. Work requires repetitive movements and extensive walking. Allergies to ragweed, goldenrod, insect spray, related chemicals, etc.","Cultivos/Materias primas: 
árboles. 
Este trabajo requiere un mínimo de dos meses de experiencia previa trabajando en un vivero, manejando tareas manuales y mecánicas asociadas con las actividades de producción y cosecha de árboles en bolas y arpillera. Los trabajadores deben ser capaces de realizar actividades manuales y mecanizadas con precisión y eficiencia. Los trabajadores que realicen tareas en cada una de las siguientes áreas específicas deberán mantener la calidad y el ritmo de trabajo según las indicaciones del Líder del Equipo.  El Gerente de Producción (Líder de Equipo) proporcionará instrucciones y supervisión general al (los) trabajador(es).  Sin embargo, se espera que los trabajadores desempeñen sus funciones de manera oportuna y competente sin una estrecha supervisión.  

Las especificaciones de trabajo del vivero pueden cambiar de vez en cuando durante la temporada debido al clima y las condiciones del mercado. Se espera que los trabajadores se ajusten a las instrucciones específicas dadas para cada día de trabajo.  
 
Poda:
Responsable de la poda de material vegetal cultivado en el campo. Se requiere el desarrollo de la coordinación mano/ojo para la poda con tijeras manuales, podadoras de pértiga y podadoras. El trabajo requerirá que los trabajadores suban escaleras para realizar tareas.  

Plantío:
Responsable de plantar material vegetal cultivado en el campo. Los trabajadores deben poder usar una pala y ser capaces de realizar físicamente la tarea requerida. Los trabajadores deben ser conscientes de la importancia de llevar los árboles jóvenes de la instalación de retención al campo y plantarlos rápidamente para maximizar la supervivencia y el crecimiento de los árboles. Se debe tener debidamente en cuenta la profundidad de plantación y los procedimientos de plantación adecuados.  

Staking:
Responsable de colocar estacas de material vegetal cultivado en el campo, lo que implica forzar una estaca en el suelo junto a un árbol y usar cinta de tutoría para pegar el árbol a la estaca para garantizar un crecimiento adecuado. Esto también incluirá la remoción de estacas mediante el uso de una llave para tubos o un extractor de estacas para aflojar la estaca antes de quitarla a mano después del período de tiempo establecido por la gerencia.  

Cosecha/Carga:
Responsable de la cosecha de material vegetal cultivado en el campo. Los trabajadores serán responsables de desarrollar un conocimiento y comprensión de los suministros de cosecha apropiados, incluyendo cestas, arpillera, clavos, engarzadores, correas adecuadas y sus ubicaciones para cosechar árboles. Los trabajadores deben ser capaces de utilizar los métodos de flejado adecuados para los diferentes cepellones, así como ser capaces de ayudar a otros si es necesario. También se requerirá ayudar a cargar el material vegetal extraído en camiones para su transporte al área de distribución.  

Claro:
Responsable de limpiar los campos en preparación para la siembra. Los trabajadores serán responsables de recoger los pedazos de raíces, rocas, árboles y otros escombros que queden después de limpiar y colocar los escombros en un cucharón de carga o en un área designada de escombros en el campo para su remoción o quema.  

Trabajos generales de vivero:
Es posible que se requiera que los trabajadores ayuden en el mantenimiento y la posible reparación de los invernaderos y otras estructuras del vivero, según sea necesario. Además, es posible que se requiera que los trabajadores realicen tareas variables como las siguientes: riego, zanja, paleada, azada, acarreo, preparación del suelo, deshierbe y otras tareas relacionadas con la operación de un vivero.

Equipo:
Es posible que se requiera que los trabajadores operen diferentes tipos de equipos utilizados en el proceso de cultivo de árboles, incluidos, entre otros: minicargadores, elevadores de pluma, elevadores de brownie, cortadoras de césped ZTR, comedores de malezas, mulas Kawasaki y motosierras, así como camiones de campo y tractores de uso diario. Se espera que los trabajadores puedan operar equipos agrícolas con o sin dirección. 
 
El trabajo debe realizarse en el campo durante largos períodos de tiempo. Los trabajadores ayudarán a cargar camiones con productos que pesen hasta 60 libras y a elevarlos a una altura de 5 pies durante largos períodos de tiempo. Los trabajadores deben ser capaces de trabajar de pie en posiciones dobladas durante largos períodos de tiempo. El trabajo requiere movimientos repetitivos y caminar mucho. Alergias a la ambrosía, la vara de oro, el repelente de insectos, productos químicos relacionados, etc.",40.0,4,0.0,11.27,0.0,0.0,True,7:30 A.M.,3:00 P.M.,2026-01-06T00:00:00Z,2026-10-31T00:00:00Z,True,2,This job requires a minimum of two months of  previous experience working in a nursery handling both manual and machine tasks associated with balled and burlap tree production and harvest activities Saturday work required. Must be able lift/carry 60 lbs. Post-hire employer-paid drug testing required.,"Este trabajo requiere un mínimo de dos meses de experiencia previa trabajando en un vivero, manejando tareas manuales y de máquina asociadas con las actividades de producción y cosecha de árboles en bolas y arpillera. Debe ser capaz de levantar/transportar 60 libras. Se requieren pruebas de drogas pagadas por el empleador después de la contratación.",False,0,None,,Hour,"Deep Fork Tree Farm, LLC",,Arcadia,OKLAHOMA,73007,+14052332000,,amanda.casio@dftrees.com,111421,,H-2A,False,100 S. Westminster Rd.,,,,Arcadia,OKLAHOMA,73007,2025-11-17T00:00:00Z,1970-01-01T00:00:00Z,45-2092.00,"Farmworkers and Laborers, Crop, Nursery, and Greenhouse",,"{'type': 'Point', 'coordinates': [-97.33283, 35.69162], 'crs': {'type': 'name', 'properties': {'name': 'EPSG:4326'}}}",True,amanda.casio@dftrees.com,+14052332000,N/A,True,244,True,38672404,2025-12-03T21:44:54.593Z,N/A,2026-06-04T00:00:00Z,2025-11-17T18:56:53Z,0.0,,,False,False,2
